{
  "schemaVersion": "jovra.room.invitation/1",
  "sample": true,
  "inviteId": "inv-c2",
  "sessionId": "sample-jon-alex",
  "hostDeviceId": "c1",
  "hostEpoch": 3,
  "hostKeySha256": "bbfbe0c66faa5f6105cdced46762eeef30997ef9279f11ffe7341c2738f13065",
  "displayCode": "JVR-482",
  "joinTokenSha256": "9fdfe8cd1fe57194868f8cb888764491f64445a95f4e3addd123078bcb5f2164",
  "secretBits": 128,
  "issuedAt": "2026-10-07T21:10:00Z",
  "expiresAt": "2026-10-07T21:20:00Z",
  "singleUse": true,
  "hostApprovalRequired": true,
  "captureRole": "camera",
  "commandRole": "viewer",
  "studioSlot": "far-baseline",
  "status": "issued",
  "usedByDeviceId": null,
  "usedAt": null,
  "revokedReason": null
}
